[
  { "id": "watermelon-lemon-mint", "name": "Арбуз + лимон + мята", "category": "fresh", "components": [ { "flavor": "арбуз", "family": "fruity", "share": 50 }, { "flavor": "лимон", "family": "citrus", "share": 30 }, { "flavor": "мята", "family": "fresh", "share": 20 } ], "profile": "Лёгкий освежающий летний микс." },
  { "id": "grape-pomegranate-mint", "name": "Виноград + гранат + мята", "category": "fresh", "components": [ { "flavor": "виноград", "family": "fruity", "share": 40 }, { "flavor": "гранат", "family": "fruity", "share": 40 }, { "flavor": "мята", "family": "fresh", "share": 20 } ], "profile": "Ягодно-фруктовый с прохладой." },
  { "id": "melon-cranberry", "name": "Дыня + клюква", "category": "fruity", "components": [ { "flavor": "дыня", "family": "fruity", "share": 60 }, { "flavor": "клюква", "family": "berry", "share": 40 } ], "profile": "Сладко-кислый, мягкий." },
  { "id": "lime-basil-mint", "name": "Лайм + базилик + мята", "category": "fresh", "components": [ { "flavor": "лайм", "family": "citrus", "share": 50 }, { "flavor": "базилик", "family": "floral", "share": 30 }, { "flavor": "мята", "family": "fresh", "share": 20 } ], "profile": "Травянисто-цитрусовый фреш." },
  { "id": "peach-pineapple", "name": "Персик + ананас", "category": "fruity", "components": [ { "flavor": "персик", "family": "fruity", "share": 60 }, { "flavor": "ананас", "family": "fruity", "share": 40 } ], "profile": "Тропический фруктовый коктейль." },
  { "id": "mango-passionfruit", "name": "Манго + маракуйя", "category": "fruity", "components": [ { "flavor": "манго", "family": "fruity", "share": 60 }, { "flavor": "маракуйя", "family": "fruity", "share": 40 } ], "profile": "Насыщенный экзотический дуэт." },
  { "id": "mango-lime", "name": "Манго + лайм", "category": "fruity", "components": [ { "flavor": "манго", "family": "fruity", "share": 70 }, { "flavor": "лайм", "family": "citrus", "share": 30 } ], "profile": "Ярче и свежее за счёт цитруса." },
  { "id": "double-apple-ice", "name": "Двойное яблоко + лёд", "category": "fruity", "components": [ { "flavor": "двойное яблоко", "family": "fruity", "share": 80 }, { "flavor": "лёд", "family": "fresh", "share": 20 } ], "profile": "Классика с прохладой." },
  { "id": "strawberry-cream", "name": "Клубника + сливки (ваниль)", "category": "dessert", "components": [ { "flavor": "клубника", "family": "berry", "share": 60 }, { "flavor": "сливки", "family": "dessert", "share": 40 } ], "profile": "Десертный, мягкий." },
  { "id": "raspberry-blueberry", "name": "Малина + черника", "category": "berry", "components": [ { "flavor": "малина", "family": "berry", "share": 50 }, { "flavor": "черника", "family": "berry", "share": 50 } ], "profile": "Чистый ягодный профиль." },
  { "id": "cherry-cola", "name": "Вишня + кола", "category": "drinks", "components": [ { "flavor": "вишня", "family": "berry", "share": 60 }, { "flavor": "кола", "family": "drinks", "share": 40 } ], "profile": "Вишнёвая кола, ностальгическая классика." },
  { "id": "apple-vanilla-cinnamon", "name": "Двойное яблоко + ваниль + корица", "category": "dessert", "components": [ { "flavor": "двойное яблоко", "family": "fruity", "share": 60 }, { "flavor": "ваниль", "family": "dessert", "share": 25 }, { "flavor": "корица", "family": "spicy", "share": 15 } ], "profile": "Печёное яблоко / яблочный пирог." },
  { "id": "chocolate-orange", "name": "Шоколад + апельсин", "category": "dessert", "components": [ { "flavor": "шоколад", "family": "dessert", "share": 60 }, { "flavor": "апельсин", "family": "citrus", "share": 40 } ], "profile": "Шоколадный апельсин." },
  { "id": "coffee-caramel", "name": "Кофе + карамель", "category": "dessert", "components": [ { "flavor": "кофе", "family": "spicy", "share": 60 }, { "flavor": "карамель", "family": "dessert", "share": 40 } ], "profile": "Десертный, тёплый." },
  { "id": "cola-lemon", "name": "Кола + лимон", "category": "drinks", "components": [ { "flavor": "кола", "family": "drinks", "share": 70 }, { "flavor": "лимон", "family": "citrus", "share": 30 } ], "profile": "Простая понятная классика." }
]
